{
  "$schema": "../schema/project-state.schema.json",
  "schemaVersion": 1,
  "reconciledAt": "2026-10-20",
  "validationPolicy": {
    "maxVerificationAgeDays": 90
  },
  "project": {
    "id": "ai-leverage-library",
    "name": "AI Leverage Library",
    "repository": "https://github.com/TOTALLYMAJOR/ai-leverage-library",
    "purpose": "A Git-native, evidence-aware library of reproducible AI techniques organized by outcome rather than provider.",
    "archetype": "library/package and developer utility",
    "primaryUser": "Practitioners and AI agents seeking reproducible, authority-bounded AI workflows",
    "economicBuyer": "UNKNOWN",
    "problemSolved": "Useful AI workflows are commonly scattered across prompts, demonstrations, and tribal knowledge without reproducible verification or explicit human authority boundaries.",
    "stage": "0.1.0 repository scaffold with one seed technique, tested experiment intake, two accepted-with-limitations bounded trial results; product use and organizational value are UNVERIFIED",
    "deploymentTarget": "UNVERIFIED - a static documentation site or PWA is specified, but no provider or deployment configuration exists"
  },
  "goals": [
    {
      "id": "GOAL-TECHNICAL",
      "type": "technical",
      "statement": "Maintain portable technique cards, catalogs, and evidence contracts that fail visibly when their structural claims drift.",
      "state": "IMPLEMENTED",
      "evidence": ["README.md", "schema/technique.schema.json", "scripts/validate.mjs"]
    },
    {
      "id": "GOAL-USER",
      "type": "user",
      "statement": "Enable a practitioner or agent to find, apply, and verify an appropriate technique without hidden context.",
      "state": "SPECIFIED",
      "evidence": ["README.md", "CATALOG.md"]
    },
    {
      "id": "GOAL-OPERATIONAL",
      "type": "operational",
      "statement": "Make technique publication and lifecycle promotion reproducible, reviewable, and resistant to evidence inflation.",
      "state": "IMPLEMENTED",
      "evidence": ["AGENTS.md", "CONTRIBUTING.md", ".github/workflows/validate.yml"]
    },
    {
      "id": "GOAL-ORGANIZATIONAL",
      "type": "organizational",
      "statement": "Demonstrate that the library improves real AI-assisted work through retained outcome evidence.",
      "state": "UNVERIFIED",
      "evidence": []
    }
  ],
  "capabilities": [
    {
      "id": "CAP-001",
      "name": "Canonical technique cards",
      "description": "Store outcome-oriented technique definitions under content/techniques with explicit verification, risk, and human authority fields.",
      "lifecycle_state": "IMPLEMENTED",
      "confidence": "HIGH",
      "evidence": [
        {"type": "source", "path": "content/techniques/discover/constraint-compilation.md", "detail": "Seed canonical card"},
        {"type": "governance", "path": "AGENTS.md", "detail": "Declares technique cards canonical"}
      ],
      "dependencies": [],
      "blockers": [],
      "last_verified": "2026-08-25",
      "owner_or_authority": "Repository maintainers; human review for authority changes and field-tested promotion",
      "is_current": true
    },
    {
      "id": "CAP-002",
      "name": "Technique contract and catalog drift validation",
      "description": "Check required card metadata, allowed values, unique IDs, category placement, and catalog agreement.",
      "lifecycle_state": "TESTED",
      "confidence": "HIGH",
      "evidence": [
        {"type": "source", "path": "scripts/validate.mjs", "detail": "No-dependency validator"},
        {"type": "test-result", "path": "scripts/validate.mjs", "command": "npm run validate", "outcome": "PASS", "detail": "Local technique, experiment, test, and project-state validation passed on 2026-09-24", "observed_at": "2026-09-24"}
      ],
      "dependencies": ["CAP-001"],
      "blockers": [],
      "last_verified": "2026-09-24",
      "owner_or_authority": "Repository maintainers",
      "is_current": true
    },
    {
      "id": "CAP-003",
      "name": "Human-readable and machine-readable catalog",
      "description": "Expose published technique metadata in CATALOG.md and catalog.yaml while cards remain canonical.",
      "lifecycle_state": "IMPLEMENTED",
      "confidence": "HIGH",
      "evidence": [
        {"type": "source", "path": "CATALOG.md", "detail": "Human navigation"},
        {"type": "source", "path": "catalog.yaml", "detail": "Machine index"}
      ],
      "dependencies": ["CAP-001", "CAP-002"],
      "blockers": [],
      "last_verified": "2026-08-25",
      "owner_or_authority": "Canonical cards control catalog content",
      "is_current": true
    },
    {
      "id": "CAP-004",
      "name": "Constraint Compilation workflow",
      "description": "Turn scattered constraints into an inspectable, authority-bounded outcome contract.",
      "lifecycle_state": "SPECIFIED",
      "confidence": "MEDIUM",
      "evidence": [
        {"type": "source", "path": "content/techniques/discover/constraint-compilation.md", "detail": "Workflow and verification contract"},
        {"type": "experiment-result", "path": "docs/project/evidence/EXP-20260915-001-outcome-contract.md", "detail": "Repository owner accepted the fresh practitioner's traced contract and failure-scenario check with documented limitations on 2026-09-24"},
        {"type": "experiment-result", "path": "docs/project/evidence/EXP-20260924-001-controller-comparison.md", "detail": "Second source-traced contract is materially consistent with PROOF-001; repository-owner acceptance with the documented independence and access-control limitations is retained in docs/project/evidence/EXP-20260924-001-human-disposition.md"}
      ],
      "dependencies": ["CAP-001"],
      "blockers": ["BLK-004"],
      "last_verified": "2026-09-24",
      "owner_or_authority": "Human reviewer for any promotion beyond specified",
      "is_current": true
    },
    {
      "id": "CAP-005",
      "name": "Pull-request and main-branch validation configuration",
      "description": "Configure GitHub Actions to run repository validation on pull requests and pushes to main.",
      "lifecycle_state": "IMPLEMENTED",
      "confidence": "HIGH",
      "evidence": [
        {
          "type": "source",
          "path": ".github/workflows/validate.yml",
          "detail": "Workflow configuration exists"
        },
        {
          "type": "test-result",
          "path": "docs/project/evidence/CI-20261020-pr3-main-validation.md",
          "command": "npm run validate (GitHub Actions)",
          "outcome": "PASS",
          "observed_at": "2026-10-20",
          "detail": "Successful PR #3 run 39514826108 and merged-main run 39515288921; exact GitHub head SHAs and limits retained in receipt. No lifecycle promotion."
        }
      ],
      "dependencies": [
        "CAP-002"
      ],
      "blockers": [],
      "last_verified": "2026-10-20",
      "owner_or_authority": "GitHub Actions provider acknowledgement is required for operational proof",
      "is_current": true
    },
    {
      "id": "CAP-006",
      "name": "Searchable documentation site or PWA",
      "description": "Provide a searchable user-facing adapter over the portable content core.",
      "lifecycle_state": "SPECIFIED",
      "confidence": "HIGH",
      "evidence": [
        {"type": "roadmap", "path": "README.md", "detail": "Listed as delivery roadmap item 1"}
      ],
      "dependencies": ["CAP-001", "CAP-003"],
      "blockers": [],
      "last_verified": "2026-08-25",
      "owner_or_authority": "UNKNOWN",
      "is_current": true
    },
    {
      "id": "CAP-007",
      "name": "Codex skill adapter",
      "description": "Retrieve and apply relevant canonical techniques through a Codex skill.",
      "lifecycle_state": "SPECIFIED",
      "confidence": "HIGH",
      "evidence": [
        {"type": "roadmap", "path": "README.md", "detail": "Listed as delivery roadmap item 2"}
      ],
      "dependencies": ["CAP-001", "CAP-003"],
      "blockers": [],
      "last_verified": "2026-08-25",
      "owner_or_authority": "UNKNOWN",
      "is_current": true
    },
    {
      "id": "CAP-008",
      "name": "Catalog CLI",
      "description": "Support search, creation, recommendation, and validation from a small command-line adapter.",
      "lifecycle_state": "SPECIFIED",
      "confidence": "HIGH",
      "evidence": [
        {"type": "roadmap", "path": "README.md", "detail": "Listed as delivery roadmap item 3"}
      ],
      "dependencies": ["CAP-001", "CAP-003"],
      "blockers": [],
      "last_verified": "2026-08-25",
      "owner_or_authority": "UNKNOWN",
      "is_current": true
    },
    {
      "id": "CAP-009",
      "name": "MCP adapter",
      "description": "Expose stabilized catalog and retrieval contracts through an MCP server.",
      "lifecycle_state": "IDEA",
      "confidence": "HIGH",
      "evidence": [
        {"type": "roadmap", "path": "README.md", "detail": "Explicitly deferred until catalog and retrieval contracts stabilize"}
      ],
      "dependencies": ["CAP-003", "CAP-008"],
      "blockers": [],
      "last_verified": "2026-08-25",
      "owner_or_authority": "UNKNOWN",
      "is_current": true
    },
    {
      "id": "CAP-010",
      "name": "Canonical project state and drift detection",
      "description": "Keep project intent, capability state, decisions, blockers, proof, and uncertainty machine-checkable and human-readable.",
      "lifecycle_state": "TESTED",
      "confidence": "HIGH",
      "evidence": [
        {"type": "source", "path": ".project/state.json", "detail": "Machine-readable ledger"},
        {"type": "source", "path": "scripts/validate-project-state.mjs", "detail": "Drift validator"},
        {"type": "test-result", "path": "scripts/validate-project-state.mjs", "command": "npm run validate:project-state", "outcome": "PASS", "observed_at": "2026-09-24", "detail": "Local structural and drift checks passed"}
      ],